{
  "$schema": "../../schemas/workflow-project.schema.json",
  "schema_version": "1.0.0",
  "project_id": "expense-reimbursement",
  "source": "business-description.txt",
  "output": "../../build/projects/expense-reimbursement",
  "catalog": "../../fixtures/catalog.snapshot.json",
  "definition": "../../contracts/system-definition.json",
  "runtime": {
    "profile": "dev",
    "adapter": "deepseek",
    "provider": "deepseek-official",
    "model": "deepseek-v4-flash"
  }
}
